{
  "addendum": {
    "contract": {
      "addendum_version": 5.1,
      "change_type": "additive",
      "extends_version": 5,
      "note": "This section clarifies windowed wiring behavior, enforces the one-growth-per-tick invariant at region level, standardizes the unfreeze one-shot flag name, records snake_case metric field names, and defines an optional Topographic preset that wraps existing windowed wiring. No v5 behavior is removed.\n"
    },
    "growth": {
      "region_growth": {
        "action": {
          "spillover_connectivity": "Use p = 1.0 unless a policy explicitly overrides (unchanged from v5)."
        },
        "invariants": {
          "one_growth_per_tick": "MUST"
        },
        "triggers_or": [
          "avgSlotsThreshold (unchanged from v5).",
          "percentAtCapFallbackThreshold (unchanged from v5)."
        ]
      }
    },
    "metrics": {
      "region_metrics": {
        "canonical_fields_snake_case": [
          "delivered_events",
          "total_slots",
          "total_synapses",
          "active_pixels",
          "centroid_row",
          "centroid_col",
          "bbox"
        ],
        "note": "CamelCase names may exist historically; new code MUST use snake_case."
      }
    },
    "presets": {
      "topographic": {
        "api": {
          "behavior": [
            "First call connect_layers_windowed(...) (center-mapped; dedupe kept).",
            "Then set each (source→center) synapse weight by distance:",
            "Gaussian:  w = exp(-d^2 / (2 * sigma_center^2))",
            "DoG:       w = max(0, exp(-d^2 / (2 * sigma_center^2)) - surround_ratio * exp(-d^2 / (2 * sigma_surround^2)))",
            "If normalize_incoming is true, scale all incoming weights for each center to sum to 1.0 (epsilon = 1e-12)."
          ],
          "name": "connect_layers_topographic(region, src_index, dst_index, cfg) -> int",
          "return_value": "Exactly the return from connect_layers_windowed: unique source count."
        },
        "config_defaults": {
          "feedback": false,
          "kernel_h": 7,
          "kernel_w": 7,
          "normalize_incoming": true,
          "padding": "same",
          "sigma_center": 2.0,
          "sigma_surround": 4.0,
          "stride_h": 1,
          "stride_w": 1,
          "surround_ratio": 0.5,
          "weight_mode": "gaussian"
        },
        "determinism": "No RNG; weights are pure functions of geometry.",
        "status": "optional_helper"
      }
    },
    "slots": {
      "naming": {
        "prefer_last_slot_once": {
          "status": "normative",
          "summary": "After unfreeze_last_slot(), the flag prefer_last_slot_once causes the neuron to prefer the same slot on the next tick exactly once; the flag then clears.\n"
        }
      }
    },
    "style": {
      "identifiers": {
        "rule": "No single- or double-character identifiers anywhere, including loop indices."
      },
      "mojo": {
        "constructs": "Use struct and fn with typed parameters."
      },
      "python_mojo": {
        "public_naming": "No leading underscores; snake_case for public names."
      }
    },
    "tests": {
      "must_pass": [
        "Windowed wiring: unique-source return, center-mapping, dedupe.",
        "Tract growth: attach_source_neuron(new_index) re-attaches deterministically.",
        "Neuron growth: fallback streak + cooldown triggers new neuron; autowiring via mesh rules.",
        "Region growth: OR-trigger works; cooldown enforced; one growth per tick invariant holds.",
        "Topographic preset (if used): Gaussian/DoG weight shape; per-target normalization sums to ~1.0."
      ]
    },
    "tick": {
      "clarifications": [
        "RegionBus.current_step MUST increment during bus decay.",
        "A Region MUST grow at most one Layer per tick. If growth occurs in a tick, Region.lastLayerGrowthStep MUST equal RegionBus.current_step for that tick."
      ]
    },
    "wiring": {
      "windowed_connect": {
        "destination_cases": {
          "output_2d": {
            "rule": "For each sliding window over the 2D source, connect ALL source pixels within the (clipped) window to exactly ONE destination neuron: the window's CENTER index (center uses floor semantics and is clamped to destination bounds). When a (source, center) pair arises from overlapping windows, keep a single edge.\n"
          }
        },
        "return_value": {
          "definition": "The function returns the number of UNIQUE source pixels that participated in ≥ 1 window."
        },
        "tracts": {
          "attach_source_neuron": {
            "status": "required",
            "summary": "When a source-layer neuron grows, Tract.attach_source_neuron(new_source_index) MUST re-attach that neuron according to the recorded window geometry so behavior remains deterministic.\n"
          }
        }
      }
    }
  },
  "behavior": {
    "busesAndDecay": {
      "configurability": {
        "inhibition_decay": "0.0..1.0; default ~0.90"
      },
      "inhibition": {
        "rule": "multiplicative decay each tick"
      },
      "modulation": {
        "rule": "reset to 1.0 each tick"
      },
      "parity": [
        "C++, Java, Python, Mojo share the same decay semantics and step counter behavior"
      ],
      "step_counter": {
        "rule": "current_step increments by 1 in decay(); get_current_step()/get_step() must return it"
      }
    },
    "frozenSlots": {
      "semantics": [
        "Weight.freeze() prevents subsequent reinforce() and update_threshold() effects for that slot.",
        "Neuron.freeze_last_slot() freezes the most recently selected slot if present; returns true if frozen.",
        "Neuron.unfreeze_last_slot() unfreezes that slot and **prefers it once** on the next selection so adaptation resumes on that slot.",
        "Frozen status is slot-local; other slots continue to adapt normally."
      ],
      "tests_required": [
        "Reinforcement does not change strength while frozen.",
        "Threshold update and fire decision ignore a frozen slot’s learning updates."
      ]
    },
    "growthEscalation": {
      "layer_growth": {
        "action": [
          "Region.request_layer_growth(saturated_layer) creates a small excitatory-only spillover layer, wires saturated → new with a modest probability (default p≈0.15)."
        ],
        "trigger": [
          "Layer.neuron_limit reached and policy on requesting neuron allows layer_growth_enabled."
        ]
      },
      "neuron_growth": {
        "action": [
          "Layer.try_grow_neuron(seed_neuron) creates a neuron of the same kind where possible, copies bus/config/limits, sets owner, appends.",
          "Region.autowire_new_neuron(layer, idx) is called to replay mesh rules and attach to relevant tracts."
        ],
        "trigger": [
          "Per-neuron fallback_streak >= fallback_growth_threshold.",
          "Effective slot_limit is active and last_slot_used_fallback was true on recent selections.",
          "Cooldown: (bus.current_step - last_growth_tick) >= neuron_growth_cooldown_ticks."
        ]
      },
      "order": [
        "slots",
        "neurons",
        "layers",
        "regions"
      ],
      "region_growth (policy-driven)": {
        "policy": {
          "avg_slots_threshold": "if average slots per neuron ≥ threshold, region may add a new layer",
          "enable_layer_growth": "must be true",
          "layer_cooldown_ticks": "cooldown between layer additions",
          "max_layers": "do not exceed",
          "percent_neurons_at_capacity_threshold": "optional additional trigger"
        },
        "safety": [
          "Growth is best-effort; if wiring data are missing, skip silently.",
          "No cross-scope side-effects: region growth does not create slots or neurons directly; it only adds layers."
        ],
        "wiring_and_determinism": [
          "Use region RNG with seed rng_seed for all cross-boundary growth decisions.",
          "Record MeshRule on connect_layers and reuse for autowiring.",
          "Windowed tracts: use attach_source_neuron(new_src_index) when the growing layer is a tract source."
        ]
      }
    },
    "metrics": {
      "RegionMetrics": {
        "fields": {
          "active_pixels": "int | null",
          "delivered_events": "int",
          "last_output_bbox": "[int, int, int, int] | null",
          "last_output_centroid": "[float, float] | null",
          "total_slots": "int",
          "total_synapses": "int"
        },
        "notes": [
          "Metrics are best-effort; spatial metrics require enable_spatial_metrics."
        ]
      }
    },
    "slotSelectionAndCapacity": {
      "scalar_selector": {
        "behavior": [
          "Anchor mode FIRST: the first value sets focus_anchor; bin index = floor( |x - anchor| / denom * 100 / bin_width_pct ).",
          "Effective slot_limit = neuron.slot_limit if >= 0 else config.slot_limit.",
          "If desired bin is new but capacity/out-of-domain prevents creation, reuse a deterministic existing slot and set last_slot_used_fallback = true.",
          "At capacity, **do not create** any new slot; reuse an existing one deterministically (implementation-defined but stable).",
          "Record last selected slot id for freeze convenience."
        ]
      },
      "spatial_selector_2d": {
        "behavior": [
          "First spatial input sets (anchor_row, anchor_col).",
          "Compute (row_bin, col_bin) with row/col bin widths; pack as a deterministic key (implementation may use row_bin * K + col_bin).",
          "Enforce the same strict capacity and fallback semantics as scalar: no new allocation at capacity; mark fallback when desired key is new/out-of-domain.",
          "Record last selected slot for freeze convenience."
        ]
      }
    },
    "spatialFocusWindowedWiring": {
      "destination_cases": {